{
  "format": "huellaaltura.deployment/1",
  "network": "amoy",
  "chainId": 80002,
  "chain": {
    "name": "Polygon Amoy",
    "nativeCurrency": {
      "name": "POL",
      "symbol": "POL",
      "decimals": 18
    },
    "rpcUrl": "https://polygon-amoy-bor-rpc.publicnode.com",
    "explorerUrl": "https://amoy.polygonscan.com",
    "kind": "testnet"
  },
  "deployer": "0xA1A1a1a1A1A1A1A1A1a1a1a1a1a1A1A1a1A1a1a1",
  "admin": "0x5afe5afE5afE5afE5afE5aFe5aFe5Afe5Afe5AfE",
  "deployedAt": "2026-10-20T15:02:11.000Z",
  "startBlock": 27100421,
  "contracts": {
    "CoffeeToken": {
      "proxy": "0xC0C0c0c0C0C0c0c0c0C0c0C0C0C0C0C0C0C0c0c0",
      "implementation": "0xC1C1c1c1C1C1C1c1c1C1C1C1c1C1C1C1c1C1c1c1",
      "abiHash": "0x0a89d93eeb3d7959135e31100a6a650440a94cacf51c64328ac9e709ec4b0a31"
    },
    "OriginRegistry": {
      "proxy": "0x0A0A0a0a0a0a0a0A0a0a0A0a0A0A0A0a0a0a0a0a",
      "implementation": "0x0B0b0b0b0B0B0B0B0b0b0b0b0B0B0B0B0B0b0B0b",
      "abiHash": "0xef1df54195cb5551661f9330d8ea171758ec05bfe8c17d0971599500c18f4818"
    },
    "TraceabilityController": {
      "proxy": "0x7C7C7c7c7C7C7c7C7c7c7C7C7c7c7C7C7c7c7c7C",
      "implementation": "0x7D7d7d7d7d7d7d7d7D7D7D7d7D7d7D7d7d7D7D7D",
      "abiHash": "0x1cc548f5311a16127c712af9620c4a774892473eb71778b92ab5bb2424b00133"
    }
  },
  "abi": {
    "CoffeeToken": [
      {
        "inputs": [],
        "stateMutability": "nonpayable",
        "type": "constructor"
      },
      {
        "inputs": [],
        "name": "AccessControlBadConfirmation",
        "type": "error"
      },
      {
        "inputs": [
          {
            "internalType": "address",
            "name": "account",
            "type": "address"
          },
          {
            "internalType": "bytes32",
            "name": "neededRole",
            "type": "bytes32"
          }
        ],
        "name": "AccessControlUnauthorizedAccount",
        "type": "error"
      },
      {
        "inputs": [
          {
            "internalType": "address",
            "name": "target",
            "type": "address"
          }
        ],
        "name": "AddressEmptyCode",
        "type": "error"
      },
      {
        "inputs": [],
        "name": "CertificateIsSoulbound",
        "type": "error"
      },
      {
        "inputs": [
          {
            "internalType": "address",
            "name": "sender",
            "type": "address"
          },
          {
            "internalType": "uint256",
            "name": "balance",
            "type": "uint256"
          },
          {
            "internalType": "uint256",
            "name": "needed",
            "type": "uint256"
          },
          {
            "internalType": "uint256",
            "name": "tokenId",
            "type": "uint256"
          }
        ],
        "name": "ERC1155InsufficientBalance",
        "type": "error"
      },
      {
        "inputs": [
          {
            "internalType": "address",
            "name": "approver",
            "type": "address"
          }
        ],
        "name": "ERC1155InvalidApprover",
        "type": "error"
      },
      {
        "inputs": [
          {
            "internalType": "uint256",
            "name": "idsLength",
            "type": "uint256"
          },
          {
            "internalType": "uint256",
            "name": "valuesLength",
            "type": "uint256"
          }
        ],
        "name": "ERC1155InvalidArrayLength",
        "type": "error"
      },
      {
        "inputs": [
          {
            "internalType": "address",
            "name": "operator",
            "type": "address"
          }
        ],
        "name": "ERC1155InvalidOperator",
        "type": "error"
      },
      {
        "inputs": [
          {
            "internalType": "address",
            "name": "receiver",
            "type": "address"
          }
        ],
        "name": "ERC1155InvalidReceiver",
        "type": "error"
      },
      {
        "inputs": [
          {
            "internalType": "address",
            "name": "sender",
            "type": "address"
          }
        ],
        "name": "ERC1155InvalidSender",
        "type": "error"
      },
      {
        "inputs": [
          {
            "internalType": "address",
            "name": "operator",
            "type": "address"
          },
          {
            "internalType": "address",
            "name": "owner",
            "type": "address"
          }
        ],
        "name": "ERC1155MissingApprovalForAll",
        "type": "error"
      },
      {
        "inputs": [
          {
            "internalType": "address",
            "name": "implementation",
            "type": "address"
          }
        ],
        "name": "ERC1967InvalidImplementation",
        "type": "error"
      },
      {
        "inputs": [],
        "name": "ERC1967NonPayable",
        "type": "error"
      },
      {
        "inputs": [],
        "name": "EnforcedPause",
        "type": "error"
      },
      {
        "inputs": [],
        "name": "ExpectedPause",
        "type": "error"
      },
      {
        "inputs": [],
        "name": "FailedCall",
        "type": "error"
      },
      {
        "inputs": [],
        "name": "InvalidInitialization",
        "type": "error"
      },
      {
        "inputs": [],
        "name": "InvalidKind",
        "type": "error"
      },
      {
        "inputs": [],
        "name": "NotInitializing",
        "type": "error"
      },
      {
        "inputs": [],
        "name": "TransferOnlyViaController",
        "type": "error"
      },
      {
        "inputs": [],
        "name": "UUPSUnauthorizedCallContext",
        "type": "error"
      },
      {
        "inputs": [
          {
            "internalType": "bytes32",
            "name": "slot",
            "type": "bytes32"
          }
        ],
        "name": "UUPSUnsupportedProxiableUUID",
        "type": "error"
      },
      {
        "inputs": [],
        "name": "ZeroAddress",
        "type": "error"
      },
      {
        "anonymous": false,
        "inputs": [
          {
            "indexed": true,
            "internalType": "address",
            "name": "account",
            "type": "address"
          },
          {
            "indexed": true,
            "internalType": "address",
            "name": "operator",
            "type": "address"
          },
          {
            "indexed": false,
            "internalType": "bool",
            "name": "approved",
            "type": "bool"
          }
        ],
        "name": "ApprovalForAll",
        "type": "event"
      },
      {
        "anonymous": false,
        "inputs": [
          {
            "indexed": false,
            "internalType": "uint64",
            "name": "version",
            "type": "uint64"
          }
        ],
        "name": "Initialized",
        "type": "event"
      },
      {
        "anonymous": false,
        "inputs": [
          {
            "indexed": false,
            "internalType": "address",
            "name": "account",
            "type": "address"
          }
        ],
        "name": "Paused",
        "type": "event"
      },
      {
        "anonymous": false,
        "inputs": [
          {
            "indexed": true,
            "internalType": "bytes32",
            "name": "role",
            "type": "bytes32"
          },
          {
            "indexed": true,
            "internalType": "bytes32",
            "name": "previousAdminRole",
            "type": "bytes32"
          },
          {
            "indexed": true,
            "internalType": "bytes32",
            "name": "newAdminRole",
            "type": "bytes32"
          }
        ],
        "name": "RoleAdminChanged",
        "type": "event"
      },
      {
        "anonymous": false,
        "inputs": [
          {
            "indexed": true,
            "internalType": "bytes32",
            "name": "role",
            "type": "bytes32"
          },
          {
            "indexed": true,
            "internalType": "address",
            "name": "account",
            "type": "address"
          },
          {
            "indexed": true,
            "internalType": "address",
            "name": "sender",
            "type": "address"
          }
        ],
        "name": "RoleGranted",
        "type": "event"
      },
      {
        "anonymous": false,
        "inputs": [
          {
            "indexed": true,
            "internalType": "bytes32",
            "name": "role",
            "type": "bytes32"
          },
          {
            "indexed": true,
            "internalType": "address",
            "name": "account",
            "type": "address"
          },
          {
            "indexed": true,
            "internalType": "address",
            "name": "sender",
            "type": "address"
          }
        ],
        "name": "RoleRevoked",
        "type": "event"
      },
      {
        "anonymous": false,
        "inputs": [
          {
            "indexed": true,
            "internalType": "address",
            "name": "operator",
            "type": "address"
          },
          {
            "indexed": true,
            "internalType": "address",
            "name": "from",
            "type": "address"
          },
          {
            "indexed": true,
            "internalType": "address",
            "name": "to",
            "type": "address"
          },
          {
            "indexed": false,
            "internalType": "uint256[]",
            "name": "ids",
            "type": "uint256[]"
          },
          {
            "indexed": false,
            "internalType": "uint256[]",
            "name": "values",
            "type": "uint256[]"
          }
        ],
        "name": "TransferBatch",
        "type": "event"
      },
      {
        "anonymous": false,
        "inputs": [
          {